
Name : Dilanga Galapita Mudiyanselage
NUID : 02592558



__________________________________________________________________________________________________________________________________

DROP DATABASE IF EXISTS medicalForum;

CREATE DATABASE medicalForum;

USE medicalForum; 


CREATE TABLE user(
	u_id CHAR(4) NOT NULL,
	type ENUM('doctor','patient'),
 	name VARCHAR(100),
	street VARCHAR(255),
	city VARCHAR(50),
	zip_code VARCHAR(5),
	password VARCHAR(250),
	dob DATE,
	PRIMARY KEY(u_id)
);

CREATE TABLE doctor(
	doctor_id CHAR(4),
	type ENUM('doctor'),
	hospital VARCHAR(100),
	specialization VARCHAR(100),
	PRIMARY KEY (doctor_id),
	CONSTRAINT fk_doctor_user FOREIGN KEY (doctor_id) 
		REFERENCES user(u_id)
			ON DELETE CASCADE
			ON UPDATE CASCADE
);

CREATE TABLE patient(
	patient_id CHAR(4),
	type ENUM('patient'),
	PRIMARY KEY (patient_id),
	CONSTRAINT fk_patient_user FOREIGN KEY (patient_id) 
		REFERENCES user(u_id)
			ON DELETE CASCADE
			ON UPDATE CASCADE
);

CREATE TABLE phone(
	u_id CHAR(4) NOT NULL,
	phone CHAR(10) NOT NULL,
	PRIMARY KEY(u_id,phone),
		CONSTRAINT fk_phone_user FOREIGN KEY (u_id) 
			REFERENCES user(u_id)
				ON DELETE CASCADE
				ON UPDATE CASCADE
);

CREATE TABLE question(
	q_id CHAR(8) NOT NULL,
	patient_id CHAR(4),
	title VARCHAR(100),
	question VARCHAR(255),
	question_time DATETIME,
	state ENUM('private','public'),
	likes INT,
	PRIMARY KEY(q_id),	
	CONSTRAINT fk_patient_question FOREIGN KEY (patient_id) 
		REFERENCES patient(patient_id)
			ON DELETE CASCADE
			ON UPDATE CASCADE
);


CREATE TABLE answer(
	q_id CHAR(8) NOT NULL,
	ans_id CHAR(8) NOT NULL,
	answer VARCHAR(255),
	answer_time DATETIME,
	likes INT,
	PRIMARY KEY(ans_id,q_id),	
	CONSTRAINT fk_question_answer FOREIGN KEY (q_id) 
		REFERENCES question(q_id)
			ON DELETE CASCADE
			ON UPDATE CASCADE
);


CREATE TABLE doctor_answer(
	doctor_id CHAR(4) NOT NULL,
	q_id CHAR(8) NOT NULL,
	ans_id CHAR(8) NOT NULL,
	PRIMARY KEY(doctor_id,q_id,ans_id),
	CONSTRAINT fk_doctor_answer FOREIGN KEY (doctor_id) 
		REFERENCES doctor(doctor_id)
			ON DELETE CASCADE
			ON UPDATE CASCADE,

	CONSTRAINT fk_answer_d_ans FOREIGN KEY (q_id,ans_id) 
		REFERENCES answer(q_id,ans_id)
			ON DELETE CASCADE
			ON UPDATE CASCADE
);


CREATE TABLE article(
	art_id CHAR(8) NOT NULL,
	doctor_id CHAR(4) NOT NULL,
	title VARCHAR(100),
	description VARCHAR(255),
	article_link VARCHAR(255),
	upload_date DATE,
	likes INT,
	PRIMARY KEY(art_id),
	CONSTRAINT fk_doctor_article FOREIGN KEY (doctor_id) 
		REFERENCES doctor(doctor_id)
			ON DELETE CASCADE
			ON UPDATE CASCADE
);


CREATE TABLE patient_comment(
	art_id CHAR(8) NOT NULL,
	patient_id CHAR(4) NOT NULL,
	comment VARCHAR(255),
	commentDate DATE,
	PRIMARY KEY(art_id,patient_id),
	CONSTRAINT fk_patent_article FOREIGN KEY (patient_id) 
		REFERENCES patient(patient_id)
			ON DELETE CASCADE
			ON UPDATE CASCADE,

	CONSTRAINT fk_article_patient FOREIGN KEY (art_id) 
		REFERENCES article(art_id)
			ON DELETE CASCADE
			ON UPDATE CASCADE
);	


CREATE TABLE question_tags(
	q_id CHAR(10) NOT NULL,
	tag VARCHAR(50),
	PRIMARY KEY(q_id,tag),
	CONSTRAINT fk_question_tags FOREIGN KEY (q_id) 
		REFERENCES question(q_id)
			ON DELETE CASCADE
			ON UPDATE CASCADE	
);


CREATE TABLE article_tags(
	art_id CHAR(10) NOT NULL,
	tag VARCHAR(50),
	PRIMARY KEY(art_id,tag),
	CONSTRAINT fk_question_tags FOREIGN KEY (art_id) 
		REFERENCES article(art_id)
			ON DELETE CASCADE
			ON UPDATE CASCADE	
);




INSERT INTO USER
VALUES
('D123','doctor','Wilma Romero','23 Cass St.','Omaha','68114','pass','1988-12-02'),
('D124','doctor','Wilma Romero','1212 Dodge St.','Lincoln','68144','pass','1982-01-02'),
('D125','doctor','Amber Mclaughlin','23 Cass St.','Omaha','68114','pass','1981-12-02'),
('P124','patient','Van Gibson','1212 Dodge St.','Omaha','68144','pass','1984-01-02'),
('D121','doctor','Devin Carlson','23 Cass St.','Grand Island','68114','pass','1988-12-02'),
('D122','doctor','Megan	Craig','1212 Dodge St.','Omaha','68144','pass','1982-01-02'),
('P121','doctor','Stephanie Brown','23 Cass St.','Omaha','68114','pass','1981-12-02'),
('P122','patient','Jonathon Rice','1212 Dodge St.','Omaha','68144','pass','1984-01-02'),
('D211','doctor','Maxine Russell','23 Cass St.','Lincoln','68114','pass','1988-12-02'),
('D212','doctor','Colin	Rios','1212 Dodge St.','Grand Island','68144','pass','1982-01-02'),
('P211','patient','Lance Walters','23 Cass St.','Omaha','68114','pass','1981-12-02'),
('P212','patient','Antoinette Coleman','1212 Dodge St.','Omaha','68144','pass','1984-01-02'),
('P219','patient','Antoinette Coleman','1212 Dodge St.','Grand Island','68144','pass','2004-01-02'),
('P319','patient','Antoinette Coleman','1212 Dodge St.','Lincoln','68144','pass','2002-01-02'),
('D319','doctor','Ronnie Bowman','23 Cass St.','Omaha','68114','pass','1988-12-02'),
('D312','doctor','Alma Mcgee','1212 Dodge St.','Lincoln','68144','pass','1982-01-02'),
('D311','doctor','Shelley Baker','23 Cass St.','Omaha','68114','pass','1981-12-02'),
('P312','patient','Fredrick Casey','1212 Dodge St.','Grand Island','68144','pass','1984-01-02'),
('D314','doctor','Joey Cain','23 Cass St.','Grand Island','68114','pass','1988-12-02'),
('D413','doctor','Kristen Briggs','1212 Dodge St.','Papillion','68144','pass','1988-01-02'),
('P413','doctor','Sheri	Campbell','23 Cass St.','Lincoln','68114','pass','1981-12-02'),
('P314','patient','Ethel Ray','1212 Dodge St.','Omaha','68144','pass','1984-01-02');


INSERT INTO doctor
VALUES
('D317','doctor','Columbus Community','Cardiologist'),
('D613','doctor','Community Memorial','Neurology'),
('D312','doctor','Omaha hospital','Cardiologist'),
('D311','doctor','CHI Health','Surgery'),
('D212','doctor','Lincoln hospital',NULL),
('D211','doctor','Omaha hospital','Anesthesiologist'),
('D121','doctor','Community Memorial','Cardiologist'),
('D122','doctor','Columbus Community','Anesthesiologist'),
('D124','doctor','Columbus Community','Neurology'),
('D123','doctor','Community Memorial','Surgery');




INSERT INTO patient
VALUES
('P123','patient'),
('P121','patient'),
('P129','patient'),
('P216','patient'),
('P212','patient'),
('P311','patient'),
('P312','patient'),
('P413','patient'),
('P124','patient'),
('P314','patient');

INSERT INTO phone
VALUES
('P123','4025559666'),
('D123','4027894562'),
('P123','4025777666'),
('D123','4024494562'),
('P123','4025546666'),
('D212','4027123682'),
('P123','4028415666'),
('P312','4026543682'),
('P123','4025545688'),
('D212','4027435673');

INSERT INTO question
VALUES
('Q0000001','P123','Wellbutrin - Does the fuzzy vision and sensitivity','When I was at the beginning of my illness and back pain was unable to function eating didnt even enter my head and I lost around a stone and a half (my usual weight sticks around 10 - 10 1/2 stone) to 9 stone','2017-12-31 12:59:59','public',12),
('Q0000002','P312','Does it always take three days to get relief from butran 5mcg patch?','Starting remeron WD week 8. Still insomnia and morning anxiety','2017-12-31 12:59:59','private',1),
('Q0000003','P123','Why do i constantly feel nausea?','why do i constantly feel nausea?','2000-12-31 12:59:59','public',-3),
('Q0000004','P312','3 week TKR post op Im only getting 75d bend','How can I reduce my husbands tramadol intake? He is taking more and more?','2017-12-31 12:59:59','private',4),
('Q0000005','P123','Does it always take three days to get relief from butran 5mcg patch?','Why did the Fischer Wallace device stop working?','1999-12-31 12:59:59','public',4),
('Q0000006','P123','a meniscus tear (horizontal) doesnt always show on the MRI itself','Do we as chronic ain patients, back pain have no options?','2017-12-31 12:59:59','private',-2),
('Q0000007','P312','Wellbutrin - Does the fuzzy vision and sensitivity','Does the fuzzy vision and sensitivity to bright light','2016-12-31 12:59:59','public',0),
('Q0000008','P312','why do i constantly feel nausea?','Why did the Fischer Wallace device stop working?','2010-12-31 12:59:59','private',0),
('Q0000009','P123','Does it always take three days to get back pain relief from butran 5mcg patch?','Unfortunately with all the new laws the government has passed on pain meds','2016-12-31 12:59:59','public',0),
('Q0000010','P121','A meniscus tear (horizontal) doesnt always show on the MRI itself','Do we as chronic ain patients, have no options?','1998-12-31 12:59:59','private',0);



INSERT INTO answer
VALUE
('Q0000001','A0000001','My guess is the doctor put you on mirt for your insomnia.','1999-12-31 23:59:59',12),
('Q0000002','A0000001',' If I do not get that extra I get the same symptoms as you. ','1999-12-31 12:59:59',1),
('Q0000001','A0000002','I take 7.5mg mirt for my insomnia PLUS sertraline (an SSR antidepressant) for my anxiety.  That combination works well apart from the need for 10 hours sleep.','1999-12-31 23:59:59',12),
('Q0000002','A0000002','I should add that when I started mirtazapine I couldnt stop eating even waking in the night craving food however for the last month I have curbed this and have replaced my binging with fruit and vegetable but with no improvement.','1999-12-31 12:59:59',1),
('Q0000005','A0000003','I have just joined Slimming World but i believe there is no point starting this until I quit Mirtazapine.','1999-12-31 23:59:59',12),
('Q0000002','A0000003','I had an appetite in the first week.','1999-12-31 12:59:59',9),
('Q0000002','A0000007','Answer content 1','2000-12-1 12:59:59',10),
('Q0000007','A0000006','Answer content 2','1999-1-31 12:59:59',20),
('Q0000001','A0000004','Answer content 5','1999-12-31 12:59:59',-3),
('Q0000002','A0000005','Answer content 3','2000-1-1 12:59:59',-5),
('Q0000004','A0000005','Answer content 6','1999-12-31 12:59:59',1),
('Q0000002','A0000004','Answer content 4','2005-1-31 12:59:59',3);


INSERT INTO doctor_answer
VALUE
('D123','Q0000001','A0000001'),
('D212','Q0000002','A0000001'),
('D123','Q0000001','A0000002'),
('D212','Q0000002','A0000005'),
('D123','Q0000002','A0000005'),
('D123','Q0000007','A0000006'),
('D212','Q0000002','A0000002'),
('D123','Q0000001','A0000003'),
('D212','Q0000005','A0000003'),
('D123','Q0000001','A0000008'),
('D212','Q0000002','A0000009'),
('D123','Q0000007','A0000004'),
('D123','Q0000007','A0000009'),
('D212','Q0000002','A0000010');

INSERT INTO article
VALUE
('Art00121','D123','Brain','Neurology India','path\\upload\\article','2012-12-02',13),
('Art00127','D123','MRI','Neurology India','path\\upload\\article','2012-12-02',13),
('Art00124','D123','CT','Neurology India','path\\upload\\article','2012-12-02',13),
('Art00122','D121','BMC Cancer','Cancer protection','path\\upload\\article','2010-12-02',1),
('Art00125','D123','Brain','Neurology India','path\\upload\\article','2012-12-02',13),
('Art00123','D121','MRI','Neurology State of the art','path\\upload\\article','2012-12-02',13),
('Art00126','D123','CT','Scans for health','path\\upload\\article','2012-12-02',13),
('Art00128','D121','BMC Cancer','Pain Research & Management','path\\upload\\article','2010-12-02',1);

INSERT INTO patient_comment
VALUES
('Art00121','P123','Really helpfull', '2012-12-02'),
('Art00122','P231','Explain more about symptoms', '2013-12-02'),
('Art00123','P123','Really helpfull', '2012-12-02'),
('Art00122','P124','Really helpfull', '2012-12-02'),
('Art00123','P231','Explain more about symptoms', '2013-12-02'),
('Art00123','P121','Really helpfull', '2012-12-02'),
('Art00124','P123','Great article', '2013-12-02');

INSERT INTO question_tags
VALUES
('Q0000001','MRI'),
('Q0000002','MRI'),
('Q0000003','Flu'),
('Q0000005','MRI'),
('Q0000007','Mental'),
('Q0000002','CT');

INSERT INTO article_tags
VALUES
('Art00121','MRI'),
('Art00122','FLU'),
('Art00121','Cancer'),
('Art00123','MRI'),
('Art00121','Mental'),
('Art00124','Scans'),
('Art00122','CT');







DROP PROCEDURE IF EXISTS delete_user_proc;

DELIMITER //

create PROCEDURE delete_user_proc(in uid CHAR(4), in type enum('patient','doctor'))
BEGIN 
IF type = 'patient' THEN
	DELETE FROM patient WHERE patient.patient_id = uid;
ELSE 
	DELETE FROM doctor WHERE doctor.doctor_id = uid;
END IF;
END//

DELIMITER ;




DROP TRIGGER IF EXISTS delete_user;

DELIMITER $$
CREATE TRIGGER delete_user AFTER DELETE ON user
FOR EACH ROW
BEGIN
   CALL delete_user_proc(OLD.u_id,OLD.type);
END;
$$

DELIMITER ;





DROP PROCEDURE IF EXISTS insert_user_proc;

DELIMITER //

create PROCEDURE insert_user_proc(in uid CHAR(4), in type enum('patient','doctor'))
BEGIN 
IF type = 'patient' THEN
	INSERT INTO patient (patient_id,type) VALUES (uid,type);
ELSE 
	INSERT INTO doctor (doctor_id,type) VALUES (uid,type);
END IF;
END//

DELIMITER ;






DROP TRIGGER IF EXISTS insert_user;

DELIMITER $$
CREATE TRIGGER insert_user AFTER INSERT ON user
FOR EACH ROW
BEGIN
   CALL insert_user_proc(NEW.u_id,NEW.type);
END;
$$

DELIMITER ;








___________________________________________________________________________________________________________________________________________________________


DB 1 Project :  24 SQL Queries



----------------------------------------------------------------------------------------------------------------------------------------------------------------

1)

Information of article uploader(Doctor) with number of Articals uploaded by the uploader(Doctor)
(Join, Group by, aggregate function)

SELECT u.name as Name, count(*) as 'Article Count' FROM user u,doctor d,article a WHERE u.u_id = d.doctor_id AND d.doctor_id = a.doctor_id GROUP BY(a.doctor_id);

Result :

+---------------+---------------+
| Name          | Article Count |
+---------------+---------------+
| Devin Carlson |             3 |
| Wilma Romero  |             5 |
+---------------+---------------+
2 rows in set (0.00 sec)

----------------------------------------------------------------------------------------------------------------------------------------------------------------

2) 

Display All the comments for article 'Art00122'

SELECT art_id, comment FROM patient_comment WHERE art_id = 'Art00122';


+----------+-----------------------------+
| art_id   | comment                     |
+----------+-----------------------------+
| Art00122 | Really helpfull             |
| Art00122 | Explain more about symptoms |
+----------+-----------------------------+
2 rows in set (0.00 sec)


----------------------------------------------------------------------------------------------------------------------------------------------------------------


3) 

Top three articles recieved highest likes

Top five questions / most liked questions 

SELECT art_id, likes as 'Number of likes', title FROM article
ORDER BY(likes) DESC 
LIMIT 3;

+----------+-----------------+-------+
| art_id   | Number of likes | title |
+----------+-----------------+-------+
| Art00121 |              13 | Brain |
| Art00127 |              13 | MRI   |
| Art00124 |              13 | CT    |
+----------+-----------------+-------+
3 rows in set (0.00 sec)


----------------------------------------------------------------------------------------------------------------------------------------------------------------



4) 

Article titles and link to articles which are tagged as 'MRI'
(String Concatanation, Join)


SELECT title, CONCAT(article_link,'\\',a.art_id,'.pdf') as link FROM article a, article_tags at WHERE a.art_id = at.art_id AND at.tag = 'MRI';


Result :
+-------+----------------------------------+
| title | link                             |
+-------+----------------------------------+
| Brain | path\upload\article\Art00121.pdf |
| MRI   | path\upload\article\Art00123.pdf |
+-------+----------------------------------+
2 rows in set (0.00 sec)


----------------------------------------------------------------------------------------------------------------------------------------------------------------


5) 

Display questions which contains the phrase "back pain"
(String Operations)
 
SELECT q_id, question FROM question WHERE question like '%back pain%';

Results:

+----------+----------------------------------------------------------------------------------------------------------------------------------------------------+
| q_id     | question                                                                                                                                           |
+----------+----------------------------------------------------------------------------------------------------------------------------------------------------+
| Q0000001 | When I was at the beginning of my illness and back pain was unable to function eating didnt even enter my head and I lost around a stone 		|
| Q0000006 | Do we as chronic ain patients, back pain have no options?                                                                                          |
+----------+----------------------------------------------------------------------------------------------------------------------------------------------------+
2 rows in set (0.00 sec)


----------------------------------------------------------------------------------------------------------------------------------------------------------------


6) 

Names of doctors who have uploaded articles grater than 2
(Group by, Having, aggregate function)


SELECT name FROM user WHERE u_id IN (SELECT doctor_id FROM article GROUP BY(doctor_id) HAVING count(*) > 2);

Result :
+---------------+
| name          |
+---------------+
| Wilma Romero  |
| Devin Carlson |
+---------------+
2 rows in set (0.00 sec)


----------------------------------------------------------------------------------------------------------------------------------------------------------------



7) 

Display all the doctors' names who have never answerd any question
(Set operation not exist using NOT IN, Sub query)


SELECT name FROM USER WHERE u_id NOT IN (SELECT doctor_id FROM doctor_answer);


Result :
+--------------------+
| name               |
+--------------------+
| Wilma Romero       |
| Amber Mclaughlin   |
| Van Gibson         |
| Devin Carlson      |
| Megan	Craig        |
| Stephanie Brown    |
| Jonathon Rice      |
| Maxine Russell     |
| Lance	Walters      |
| Antoinette Coleman |
| Ronnie Bowman      |
| Alma Mcgee         |
| Shelley Baker      |
| Fredrick Casey     |
| Joey Cain          |
| Kristen Briggs     |
| Sheri	Campbell     |
| Ethel Ray          |
+--------------------+
18 rows in set (0.00 sec)


----------------------------------------------------------------------------------------------------------------------------------------------------------------



8)
Average number of answers per question and in decending order of average
(ORDER BY, GROUP BY, aggregate function, Subqueries in the FROM Clause)


SELECT t.q_id as 'Question Id', AVG(counts) as Average FROM (SELECT q_id, Count(*) AS counts FROM answer GROUP BY q_id) AS t GROUP BY (t.q_id) ORDER BY (Average) DESC;

Result :
+-------------+---------+
| Question Id | Average |
+-------------+---------+
| Q0000002    |  6.0000 |
| Q0000001    |  3.0000 |
| Q0000007    |  1.0000 |
| Q0000004    |  1.0000 |
| Q0000005    |  1.0000 |
+-------------+---------+
5 rows in set (0.00 sec)



----------------------------------------------------------------------------------------------------------------------------------------------------------------


9)

Reset all the like counts of questions posted before year 2000

UPDATE question
SET likes = 0
WHERE YEAR(question_time) > 2000



----------------------------------------------------------------------------------------------------------------------------------------------------------------



10)

Contact details(Phone numbers) of Doctors doesn't specify their specialization 

SELECT distinct(u.name) as 'Doctor Name', p.phone FROM user u, phone p, doctor d WHERE u.u_id = d.doctor_id AND u.u_id = p.u_id AND specialization is NULL;

+-------------+------------+
| Doctor Name | phone      |
+-------------+------------+
| Colin	Rios  | 4027123682 |
| Colin	Rios  | 4027435673 |
+-------------+------------+
2 rows in set (0.00 sec)


----------------------------------------------------------------------------------------------------------------------------------------------------------------



11)

Patiets who have asked only one question so far
(Duplicate values elimination)

SELECT name from user WHERE u_id IN (SELECT patient_id FROM question GROUP BY(patient_id) HAVING (count(*) = 1));


Result:

+---------------------------+
| Maximum number of answers |
+---------------------------+
|                         6 |
+---------------------------+
1 row in set (0.00 sec)


----------------------------------------------------------------------------------------------------------------------------------------------------------------



12) Remove all the questions which have no answers and asked befor year 2000
(DELETE, except using NOI IN, SUB QUERY, DATE functions)


DELETE FROM question WHERE q_id NOT IN (SELECT q_id FROM answer) AND YEAR(question_time) < 2000 ;


----------------------------------------------------------------------------------------------------------------------------------------------------------------


13) 

Questions asked in 2000 or 2010


SELECT q_id, question FROM question WHERE YEAR(question_time) IN(2000,2010);



Result:

+----------+--------------------------------------------------+
| q_id     | question                                         |
+----------+--------------------------------------------------+
| Q0000003 | why do i constantly feel nausea?                 |
| Q0000008 | Why did the Fischer Wallace device stop working? |
+----------+--------------------------------------------------+
2 rows in set (0.03 sec)




----------------------------------------------------------------------------------------------------------------------------------------------------------------


14)

Remove quetions which does not have answers as well as more dislikes (negative likes)
(Using Left join achived except and delete)


DELETE question FROM question LEFT JOIN answer ON question.q_id = answer.q_id WHERE answer.q_id is NULL AND question.likes < 0;


----------------------------------------------------------------------------------------------------------------------------------------------------------------

15)


Update all the private questions asked by the patient 'P312', to public state.


UPDATE question 
SET state = 'public'
WHERE patient_id = 'P312' AND state = 'private';


----------------------------------------------------------------------------------------------------------------------------------------------------------------


16)

Articles uploaded withing year 2000 to year 2016



SELECT distinct(doctor_id) as 'Doctor Id',u.name as 'Uploaded By', Description, year(a.upload_date) as 'Uploaded year' FROM article a, user u WHERE u.u_id = a.doctor_id AND YEAR(a.upload_date) BETWEEN 2000 AND 2016;



Result :
+-----------+---------------+----------------------------+---------------+
| Doctor Id | Uploaded By   | Description                | Uploaded year |
+-----------+---------------+----------------------------+---------------+
| D123      | Wilma Romero  | Neurology India            |          2012 |
| D121      | Devin Carlson | Cancer protection          |          2010 |
| D121      | Devin Carlson | Neurology State of the art |          2012 |
| D123      | Wilma Romero  | Scans for health           |          2012 |
| D121      | Devin Carlson | Pain Research & Management |          2010 |
+-----------+---------------+----------------------------+---------------+
5 rows in set (0.00 sec)



----------------------------------------------------------------------------------------------------------------------------------------------------------------



17)

Create View to get age of every doctor. Using that View, display Doctor Name, Hospital and Specialization of doctors' age grater than 30. 



DROP VIEW IF EXISTS doctor_age;

CREATE VIEW doctor_age as SELECT u_id, name, year(now())-year(dob) as age FROM user WHERE u_id like 'D%';

SELECT a.name as 'Doctor Name', d.Hospital as 'Hospital', d.specialization as 'Specialization' FROM doctor d, patient_age a WHERE a.u_id = d.doctor_id AND a.age > 30;  


Result:

+----------------+--------------------+------------------+
| Doctor Name    | Hospital           | Specialization   |
+----------------+--------------------+------------------+
| Kristen Briggs | Community Memorial | Neurology        |
| Alma Mcgee     | Omaha hospital     | Cardiologist     |
| Colin	Rios     | Lincoln hospital   | NULL             |
| Megan	Craig    | Columbus Community | Anesthesiologist |
| Wilma Romero   | Columbus Community | Neurology        |
+----------------+--------------------+------------------+
5 rows in set (0.00 sec)



----------------------------------------------------------------------------------------------------------------------------------------------------------------

18)

Display maximum number of answers for a question all the time



SELECT MAX(y.num) as 'Maximum number of answers'
  		FROM (SELECT q_id,COUNT(*) AS num FROM answer GROUP BY(q_id)) y


Result :
+---------------------------+
| Maximum number of answers |
+---------------------------+
|                         6 |
+---------------------------+
1 row in set (0.00 sec)
s


----------------------------------------------------------------------------------------------------------------------------------------------------------------


19)

Stored procedure to delete user and display message 


DROP PROCEDURE IF EXISTS removeUser;

delimiter $$
CREATE PROCEDURE removeUser(IN user_id CHAR(4))
BEGIN 
    DECLARE message VARCHAR(100);

    DELETE FROM user WHERE  u_id = user_id ;
    SELECT CONCAT('User account having user ID = ',user_id,' deleted') as "Message";
END $$

delimiter ;

CALL removeUser('P211');


Result :

+-------------------------------------------+
| Message                                   |
+-------------------------------------------+
| User account having user ID =P211 deleted |
+-------------------------------------------+
1 row in set (0.00 sec)


----------------------------------------------------------------------------------------------------------------------------------------------------------------

20)


Create view for calculate patient age and using that remove all the registerd patients age less than 18. 



DROP VIEW IF EXISTS patient_age;

CREATE VIEW patient_age as SELECT u_id, year(now())-year(dob) as age FROM user WHERE u_id like 'P%';

DELETE user FROM user, patient_age WHERE user.u_id = patient_age.u_id AND patient_age.age < 18; 


----------------------------------------------------------------------------------------------------------------------------------------------------------------

21)


Tags wihch are tagged with both artcles and questions
(SET Intersection using Inner join)



SELECT distinct(qt.tag) FROM question_tags qt INNER JOIN article_tags at ON qt.tag = at.tag;



Result :
+--------+
| tag    |
+--------+
| Mental |
| MRI    |
| CT     |
| Flu    |
+--------+
4 rows in set (0.00 sec)


----------------------------------------------------------------------------------------------------------------------------------------------------------------

22)

 Name and Address of all the patients in Omaha and doctors works who works either 'Columbus Community','Community Memorial' and ORDER BY name
(UNION, ORDER BY, )


Select name as Name,CONCAT(street," ",city," ",zip_code) as Address 
from
(
   Select name, street, city, zip_code
   From User
   Where city = 'Omaha'

  	Union

   Select name, street, city, zip_code
   From User
   Where u_id IN (SELECT doctor_id FROM doctor WHERE hospital IN ('Columbus Community','Community Memorial'))
) userInfo
order by name;


Results :
+--------------------+----------------------------+
| Name               | Address                    |
+--------------------+----------------------------+
| Alma Mcgee         | 1212 Dodge St. Omaha 68144 |
| Amber Mclaughlin   | 23 Cass St. Omaha 68114    |
| Antoinette Coleman | 1212 Dodge St. Omaha 68144 |
| Colin	Rios         | 1212 Dodge St. Omaha 68144 |
| Devin Carlson      | 23 Cass St. Omaha 68114    |
| Ethel Ray          | 1212 Dodge St. Omaha 68144 |
| Fredrick Casey     | 1212 Dodge St. Omaha 68144 |
| Joey Cain          | 23 Cass St. Omaha 68114    |
| Jonathon Rice      | 1212 Dodge St. Omaha 68144 |
| Kristen Briggs     | 1212 Dodge St. Omaha 68144 |
| Lance	Walters      | 23 Cass St. Omaha 68114    |
| Maxine Russell     | 23 Cass St. Omaha 68114    |
| Megan	Craig        | 1212 Dodge St. Omaha 68144 |
| Ronnie Bowman      | 23 Cass St. Omaha 68114    |
| Shelley Baker      | 23 Cass St. Omaha 68114    |
| Sheri	Campbell     | 23 Cass St. Omaha 68114    |
| Stephanie Brown    | 23 Cass St. Omaha 68114    |
| Van Gibson         | 1212 Dodge St. Omaha 68144 |
| Wilma Romero       | 1212 Dodge St. Omaha 68144 |
| Wilma Romero       | 23 Cass St. Omaha 68114    |
+--------------------+----------------------------+
20 rows in set (0.00 sec)



----------------------------------------------------------------------------------------------------------------------------------------------------------------

23)




Most liked questions of all time
(Join, sub query, Aggregation)

SELECT p.patient_id, q.title, q.question, q.likes FROM question q, patient p WHERE q.patient_id = p.patient_id AND q.likes IN (SELECT MAX(likes) FROM question);


Result:

+------------+----------------------------------------------------+------------------------------------------------------------------------------------------------------------------------------------------------------------------------------------------------------------------+-------+
| patient_id | title                                              | question                                                                                                                                                                                                         | likes |
+------------+----------------------------------------------------+------------------------------------------------------------------------------------------------------------------------------------------------------------------------------------------------------------------+-------+
| P123       | Wellbutrin - Does the fuzzy vision and sensitivity | When I was at the beginning of my illness and back pain was unable to function eating didnt even enter my head and I lost around a stone and a half (my usual weight sticks around 10 - 10 1/2 stone) to 9 stone |    12 |
+------------+----------------------------------------------------+------------------------------------------------------------------------------------------------------------------------------------------------------------------------------------------------------------------+-------+
1 row in set (0.06 sec)



----------------------------------------------------------------------------------------------------------------------------------------------------------------
24)

Update working hospitals of doctors' such that, if city of doctor is Papillion, then the new hospital is 'Community Memorial', where as city is 'Grand Island', 
then hospital is 'Columbus Community' 



UPDATE user u JOIN doctor d ON u.u_id = d.doctor_id 
SET d.hospital = CASE
	WHEN u.city = 'Papillion'
		THEN 'Community Memorial'
	WHEN u.city = 'Grand Island'
		THEN 'Columbus Community'
END;


----------------------------------------------------------------------------------------------------------------------------------------------------------------




